{
  "$schema": "../../tools/Blazor.DOM.TypeScriptModel/schema/coverage.schema.json",
  "schemaVersion": 2,
  "typescript": {
    "symbolCount": 2183,
    "declarationCount": 3022,
    "declarationKinds": {
      "globalFunction": 120,
      "globalVariable": 940,
      "interface": 1577,
      "namespace": 7,
      "typeAlias": 378
    },
    "memberCount": 12221,
    "memberKinds": {
      "callSignature": 48,
      "constructSignature": 686,
      "getter": 30,
      "indexSignature": 43,
      "method": 3024,
      "property": 8362,
      "setter": 28
    },
    "typeExpressionCount": 33950,
    "typeExpressionKinds": {
      "AnyKeyword": 1119,
      "ArrayType": 261,
      "BigIntKeyword": 1,
      "BooleanKeyword": 1581,
      "ExpressionWithTypeArguments": 847,
      "FunctionType": 924,
      "IndexedAccessType": 488,
      "IntersectionType": 6,
      "LiteralType": 4623,
      "NeverKeyword": 1,
      "NumberKeyword": 1999,
      "ObjectKeyword": 2,
      "ParenthesizedType": 474,
      "StringKeyword": 2748,
      "TemplateLiteralType": 6,
      "TupleType": 28,
      "TypeLiteral": 736,
      "TypeOperator": 488,
      "TypeQuery": 13,
      "TypeReference": 12831,
      "UndefinedKeyword": 97,
      "UnionType": 2731,
      "UnknownKeyword": 7,
      "VoidKeyword": 1939
    },
    "mergedSymbolCount": 752,
    "eventMapCount": 80,
    "constructorObjectCount": 680
  },
  "webIdl": {
    "specificationCount": 325,
    "definitionCount": 3554,
    "canonicalSymbolCount": 2750,
    "definitionKinds": {
      "callback": 75,
      "callback interface": 3,
      "dictionary": 1050,
      "enum": 392,
      "includes": 268,
      "interface": 1474,
      "interface mixin": 125,
      "namespace": 19,
      "typedef": 148
    },
    "includeStatementCount": 268,
    "memberCount": 11338,
    "memberKinds": {
      "async_iterable": 2,
      "attribute": 4104,
      "const": 1006,
      "constructor": 450,
      "field": 3245,
      "iterable": 15,
      "maplike": 14,
      "operation": 2492,
      "setlike": 10
    },
    "argumentCount": 4306
  },
  "reconciliation": {
    "matched": 2013,
    "matchedWebIdl": 1691,
    "unmatchedTypeScript": [
      "AbortSignalEventMap",
      "AbstractWorkerEventMap",
      "AnimationEventMap",
      "AudioDecoderEventMap",
      "AudioEncoderEventMap",
      "AudioScheduledSourceNodeEventMap",
      "AudioWorkletNodeEventMap",
      "AutoFill",
      "AutoFillAddressKind",
      "AutoFillBase",
      "AutoFillContactField",
      "AutoFillContactKind",
      "AutoFillCredentialField",
      "AutoFillField",
      "AutoFillNormalField",
      "AutoFillSection",
      "BaseAudioContextEventMap",
      "BroadcastChannelEventMap",
      "ClientRect",
      "ClientTypes",
      "ComputedKeyframe",
      "Console",
      "CookieStoreEventMap",
      "DocumentEventMap",
      "ElementEventMap",
      "ElementTagNameMap",
      "EventListenerObject",
      "EventListenerOrEventListenerObject",
      "EventSourceEventMap",
      "FileReaderEventMap",
      "FileSystemDirectoryHandleAsyncIterator",
      "FontDisplay",
      "FontFaceSetEventMap",
      "FormDataIterator",
      "GPUAllowSharedBufferSource",
      "GPUCanvasConfigurationOut",
      "GPUExtent3DDictStrict",
      "GPUExtent3DStrict",
      "GPUImageCopyBuffer",
      "GPUImageCopyExternalImage",
      "GPUImageCopyExternalImageSource",
      "GPUImageCopyTexture",
      "GPUImageCopyTextureTagged",
      "GPUImageDataLayout",
      "GPUOrigin2DDictStrict",
      "GPUOrigin2DStrict",
      "GlobalCompositeOperation",
      "GlobalEventHandlersEventMap",
      "HTMLBodyElementEventMap",
      "HTMLCollectionBase",
      "HTMLCollectionOf",
      "HTMLDocument",
      "HTMLElementDeprecatedTagNameMap",
      "HTMLElementEventMap",
      "HTMLElementTagNameMap",
      "HTMLFrameSetElementEventMap",
      "HTMLMediaElementEventMap",
      "HTMLOrSVGElement",
      "HTMLTableDataCellElement",
      "HTMLTableHeaderCellElement",
      "HTMLVideoElementEventMap",
      "HeadersIterator",
      "IDBDatabaseEventMap",
      "IDBOpenDBRequestEventMap",
      "IDBRequestEventMap",
      "IDBTransactionEventMap",
      "IDBValidKey",
      "ImportMeta",
      "InsertPosition",
      "Keyframe",
      "MIDIAccessEventMap",
      "MIDIInputEventMap",
      "MIDIPortEventMap",
      "MathMLElementEventMap",
      "MathMLElementTagNameMap",
      "MediaDevicesEventMap",
      "MediaKeySessionEventMap",
      "MediaKeyStatusMapIterator",
      "MediaQueryListEventMap",
      "MediaRecorderEventMap",
      "MediaSourceEventMap",
      "MediaStreamEventMap",
      "MediaStreamTrackEventMap",
      "MessageEventTargetEventMap",
      "MessagePortEventMap",
      "MutationRecordType",
      "NavigationHistoryEntryEventMap",
      "NodeListOf",
      "NotificationEventMap",
      "OfflineAudioContextEventMap",
      "OffscreenCanvasEventMap",
      "OptionalPostfixToken",
      "OptionalPrefixToken",
      "PaymentAddress",
      "PaymentRequestEventMap",
      "PaymentResponseEventMap",
      "PerformanceEventMap",
      "PermissionName",
      "PermissionStatusEventMap",
      "PictureInPictureWindowEventMap",
      "PopoverInvokerElement",
      "PropertyIndexedKeyframes",
      "RTCDTMFSenderEventMap",
      "RTCDataChannelEventMap",
      "RTCDtlsTransportEventMap",
      "RTCEncodedVideoFrameType",
      "RTCIceTransportEventMap",
      "RTCPeerConnectionEventMap",
      "RTCRtpTransform",
      "RTCSctpTransportEventMap",
      "ReadableStreamAsyncIterator",
      "ReadableStreamReadDoneResult",
      "ReadableStreamReadValueResult",
      "RemotePlaybackEventMap",
      "SVGElementEventMap",
      "SVGElementTagNameMap",
      "SVGSVGElementEventMap",
      "ScreenOrientationEventMap",
      "ScriptProcessorNodeEventMap",
      "ServiceWorkerContainerEventMap",
      "ServiceWorkerEventMap",
      "ServiceWorkerRegistrationEventMap",
      "ShadowRootEventMap",
      "SourceBufferEventMap",
      "SourceBufferListEventMap",
      "SpeechSynthesisEventMap",
      "SpeechSynthesisUtteranceEventMap",
      "StyleMedia",
      "StylePropertyMapReadOnlyIterator",
      "TextTrackCueEventMap",
      "TextTrackEventMap",
      "TextTrackListEventMap",
      "Transferable",
      "URLSearchParamsIterator",
      "UnderlyingByteSource",
      "UnderlyingDefaultSource",
      "VideoDecoderEventMap",
      "VideoEncoderEventMap",
      "VisualViewportEventMap",
      "WakeLockSentinelEventMap",
      "WebAssembly.CompileError",
      "WebAssembly.ExportValue",
      "WebAssembly.Exports",
      "WebAssembly.GlobalDescriptor",
      "WebAssembly.ImportExportKind",
      "WebAssembly.ImportValue",
      "WebAssembly.Imports",
      "WebAssembly.LinkError",
      "WebAssembly.MemoryDescriptor",
      "WebAssembly.ModuleExportDescriptor",
      "WebAssembly.ModuleImportDescriptor",
      "WebAssembly.ModuleImports",
      "WebAssembly.RuntimeError",
      "WebAssembly.TableDescriptor",
      "WebAssembly.TableKind",
      "WebAssembly.ValueType",
      "WebAssembly.ValueTypeMap",
      "WebAssembly.WebAssemblyInstantiatedSource",
      "WebSocketEventMap",
      "WindowEventHandlersEventMap",
      "WindowEventMap",
      "WindowProxy",
      "WorkerEventMap",
      "XMLHttpRequestEventMap",
      "XMLHttpRequestEventTargetEventMap",
      "__GPUDeviceEventMap",
      "toString"
    ],
    "unmatchedWebIdl": [
      "ARIANotifyMixin",
      "AacBitstreamFormat",
      "AacEncoderConfig",
      "AbsoluteOrientationSensor",
      "Accelerometer",
      "AccelerometerLocalCoordinateSystem",
      "AccelerometerSensorOptions",
      "ActivationBlockersMixin",
      "ActivationBlockersMixinBlockerReason",
      "AddressInit",
      "AddressType",
      "AddressValue",
      "AeadParams",
      "AllAcceptedCredentialsOptions",
      "AmbientLightSensor",
      "AnimationNodeList",
      "AnimationTrigger",
      "AnimationTriggerBehavior",
      "AnimationTriggerOptions",
      "AnimationWorkletGlobalScope",
      "AnimatorInstanceConstructor",
      "AppBannerPromptOutcome",
      "Argon2Params",
      "AriaNotificationOptions",
      "AriaNotifyPriority",
      "ArrayBufferView",
      "Attribution",
      "AttributionAggregationProtocol",
      "AttributionAggregationService",
      "AttributionAggregationServices",
      "AttributionConversionOptions",
      "AttributionConversionResult",
      "AttributionImpressionOptions",
      "AttributionImpressionResult",
      "AudioContextRenderSizeCategory",
      "AudioOutputOptions",
      "AudioParamDescriptor",
      "AudioPlaybackStats",
      "AudioSession",
      "AudioSessionState",
      "AudioSessionType",
      "AudioSinkInfo",
      "AudioSinkOptions",
      "AudioSinkType",
      "AudioTrack",
      "AudioTrackList",
      "AudioWorkletGlobalScope",
      "AudioWorkletProcessCallback",
      "AudioWorkletProcessor",
      "AudioWorkletProcessorConstructor",
      "AuthenticationExtensionsClientOutputsJSON",
      "AuthenticationExtensionsLargeBlobOutputsJSON",
      "AuthenticationExtensionsPRFOutputsJSON",
      "AuthenticationExtensionsPaymentInputs",
      "AuthenticationExtensionsPaymentOutputs",
      "AuthenticationResponseJSON",
      "AuthenticatorAssertionResponseJSON",
      "AuthenticatorAttestationResponseJSON",
      "AutofillEvent",
      "AutofillEventInit",
      "AutofillValueEntry",
      "AutoplayPolicy",
      "AutoplayPolicyMediaType",
      "Availability",
      "AvailabilityStatus",
      "BackgroundFetchEvent",
      "BackgroundFetchEventInit",
      "BackgroundFetchFailureReason",
      "BackgroundFetchManager",
      "BackgroundFetchOptions",
      "BackgroundFetchRecord",
      "BackgroundFetchRegistration",
      "BackgroundFetchResult",
      "BackgroundFetchUIOptions",
      "BackgroundFetchUpdateUIEvent",
      "BackgroundSyncOptions",
      "BarcodeDetector",
      "BarcodeDetectorOptions",
      "BarcodeFormat",
      "BaseComputedKeyframe",